date,source,title,description,url,ticker,source_type
2025-12-05T18:09:54Z,Biztoc.com,P/E Ratio Insights for MercadoLibre,"In the current market session, MercadoLibre Inc. (NASDAQ:MELI) stock price is at $2139.00, after a 0.03% drop. However, over the past month, the company's stock increased by 0.63%, and in the past year, by 15.05%. Shareholders might be interested in knowing w…",https://biztoc.com/x/eba8cc568987b9b0,MELI,newsapi_everything
2025-12-04T13:55:44Z,Yahoo Entertainment,"MercadoLibre, Inc. (MELI): A Bull Case Theory","We came across a bullish thesis on MercadoLibre, Inc. on X.com by DG_Invests. In this article, we will summarize the bulls’ thesis on MELI. MercadoLibre, Inc...",https://finance.yahoo.com/news/mercadolibre-inc-meli-bull-case-135544859.html,MELI,newsapi_everything
2025-12-03T04:51:15Z,Human Rights Watch,Cameroon: Prominent Opposition Leader Dies in Custody,"Click to expand Image
 



 
 
 

 
 
 
 
 Anicet Ekane, Cameroon, 2019.
 © Private
 
 


 
(Nairobi) – The death in custody of a prominent Cameroon opposition leader, Anicet Ekane, should be impartially, promptly, and effectively investigated, Human Rights W…",https://www.hrw.org/news/2025/12/03/cameroon-prominent-opposition-leader-dies-in-custody,MELI,newsapi_everything
2025-12-02T14:06:08Z,Yahoo Entertainment,MercadoLibre (MELI) Slid in Q3 Despite Reporting Strong Results,"Baron Funds, an investment management company, released its “Baron Fifth Avenue Growth Fund” third-quarter 2025 investor letter. A copy of the letter can be ...",https://finance.yahoo.com/news/mercadolibre-meli-slid-q3-despite-140608567.html,MELI,newsapi_everything
2025-12-01T18:55:20Z,Yahoo Entertainment,MercadoLibre (MELI) Sees Minor Fluctuation in Analyst Sentiment,"We recently published 12 Best Consumer Cyclical Stocks to Buy According to Analysts. MercadoLibre, Inc. (NASDAQ:MELI) is one of the best consumer cyclical...",https://finance.yahoo.com/news/mercadolibre-meli-sees-minor-fluctuation-185520690.html,MELI,newsapi_everything
2025-12-01T15:24:06Z,BBC News,Shock in Cameroon as 74-year-old opposition firebrand dies in detention,"Anicet Ekane's lawyer says the family was given little explanation - ""his wife was just presented the corpse"".",https://www.bbc.com/news/articles/ckg9204y4w5o,MELI,newsapi_everything
2025-12-01T12:31:13Z,Biztoc.com,This Latin American E-Commerce Stock Could Be Worth $500 Billion in 10 Years,"Key Points
-
MercadoLibre is an e-commerce and fintech leader in Latin America.
-
The company could keep growing aggressively for many years.
-
Taking the long view, MercadoLibre shares look cheap today.
Many investors are biased toward stocks in their home c…",https://biztoc.com/x/eda69d2a9a8555e2,MELI,newsapi_everything
2025-11-30T21:37:26Z,Biztoc.com,5 Amazing Growth Stocks to Buy Before 2026,"Key Points
-
MercadoLibre and Amazon both have serious long-term opportunities in e-commerce.
-
On and Dutch Bros are both thriving despite a challenging operating environment.
-
Nu is expanding into new regions and adding services to its platform.
We're gett…",https://biztoc.com/x/0735f23782c043f5,MELI,newsapi_everything
2025-11-30T04:29:08Z,The Times of India,Meesho sets aside Rs 480 crore from IPO for salaries. Worrying signal or smart talent investment?,"Meesho is witnessing strong investor interest ahead of its Rs 5,421-crore IPO, with grey market signals suggesting a ~30% listing premium over the issue price of Rs 111. The offering includes a fresh issue of Rs 4,250 crore and an OFS of 10.55 crore shares by…",https://economictimes.indiatimes.com/markets/stocks/news/meesho-sets-aside-rs-480-crore-from-ipo-for-salaries-worrying-signal-or-smart-talent-investment/articleshow/125668535.cms,MELI,newsapi_everything
2025-11-29T17:09:02Z,Biztoc.com,"These Are 2 of the Smartest Growth Stocks to Invest $5,000 in Today","Key Points
-
Both of these stocks are growing by leaps and bounds.
-
MercadoLibre boasts a cohesive ecosystem that is driving revenue and profits forward.
-
Eli Lilly has a growing portfolio of GLP-1 drugs, but there's more for investors to be excited about.
…",https://biztoc.com/x/88a80b5f17e0bbd9,MELI,newsapi_everything
2025-11-27T04:29:36Z,Breaking NEWS in KENYA for Today Right Now & Kenyan News | TUKO,PC Peter Raburu: Kenyans Share Wholesome Experiences with Willis's Influential Dad,"Willis Raburu, known for his versatility in media, shared that his father, Peter Raburu, served as a provincial commissioner, leaving a lasting legacy of integrity.",https://www.tuko.co.ke/entertainment/celebrities/610907-pc-peter-raburu-kenyans-share-wholesome-experiences-williss-influential-dad/,MELI,newsapi_everything
2025-11-26T20:29:39Z,Yahoo Entertainment,"Citi Reduces PT on MercadoLibre (MELI) to $2,500 From $2,700, Keeps a Buy Rating","MercadoLibre, Inc. (NASDAQ:MELI) is one of the best large cap stocks to invest in for the long term. Citi slashed the price target on MercadoLibre, Inc...",https://finance.yahoo.com/news/citi-reduces-pt-mercadolibre-meli-202939337.html,MELI,newsapi_everything
2025-11-26T17:37:42Z,VC Star,Fernandez's 37 points lift St. Bonaventure to first win for Pinkard,"Sophia Fernandez dropped in 37 points as St. Bonaventure delivered Dee Pinkard's first win as head coach, and more Tuesday highlights from basketball and soccer.",https://www.vcstar.com/story/sports/high-school/2025/11/26/fernandezs-37-points-lift-st-bonaventure-to-first-win-for-pinkard/87482356007/,MELI,newsapi_everything
2025-11-26T10:28:52Z,Biztoc.com,Has MELI Stock Been Good for Investors?,"Key Points
-
MercadoLibre is one of the best stocks of the past decade because of how much it has grown.
-
If the company can keep growing revenue and profits, it could be a good stock from here.
Latin America's MercadoLibre (NASDAQ: MELI) -- an e-commerce, l…",https://biztoc.com/x/0dd63c39639685d4,MELI,newsapi_everything
2025-11-26T08:00:00Z,Arsenal.com,Preview: Arsenal v Bayern Munich,Check out all you need to know about our clash at home to Bayern Munich in the UEFA Champions League,https://www.arsenal.com/news/preview-arsenal-v-bayern-munich-0,MELI,newsapi_everything
2025-11-25T22:45:01Z,Biztoc.com,Here's How Much $100 Invested In MercadoLibre 15 Years Ago Would Be Worth Today,"MercadoLibre (NASDAQ:MELI) has outperformed the market over the past 15 years by 13.54% on an annualized basis producing an average annual return of 25.68%. Currently, MercadoLibre has a market capitalization of $104.36 billion.
Buying $100 In MELI: If an inv…",https://biztoc.com/x/cb486c3345e415d6,MELI,newsapi_everything
2025-11-25T17:05:00Z,Dailycannon.com,Arsenal v Bayern Munich referee announced,UEFA have appointed an all-Italian officiating team to take charge of Arsenal’s midweek match at home to Bayern Munich.Photo by Marco Luzzani/Getty ImagesUEFA have now confirmed their match official...,https://dailycannon.com/2025/11/arsenal-bayern-referee/,MELI,newsapi_everything
2025-11-25T13:01:43Z,Biztoc.com,"MercadoLibre Tries Woo Brazil’s Online Shoppers as Amazon, Shein Close In",,https://biztoc.com/x/3682108934c3f337,MELI,newsapi_everything
2025-11-25T10:16:00Z,GlobeNewswire,"Argentina Buy Now Pay Later Business Report 2025-2030: $6.19 Billion Market Opportunities Driven by E-commerce and Offline Retail Innovations, Fintech Integration, and Sector Diversification","The Argentine BNPL market presents growth opportunities driven by e-commerce and offline retail innovations, fintech integration, and sector diversification. Leading platforms and fintechs offer flexible payment plans to address inflation and cash flow challe…",https://www.globenewswire.com/news-release/2025/11/25/3194117/28124/en/Argentina-Buy-Now-Pay-Later-Business-Report-2025-2030-6-19-Billion-Market-Opportunities-Driven-by-E-commerce-and-Offline-Retail-Innovations-Fintech-Integration-and-Sector-Diversifi.html,MELI,newsapi_everything
2025-11-25T09:27:00Z,GlobeNewswire,"China Buy Now Pay Later Business Report 2025-2030: Growing Dominance of Super Apps, Multiple Sector Expansion, Low Entry for Foreign Competitors","China's BNPL market is rapidly expanding, driven by e-commerce growth, high smartphone usage, and integration into financial platforms like Alipay and WeChat Pay. Key opportunities include expanding into offline retail and new sectors such as education and he…",https://www.globenewswire.com/news-release/2025/11/25/3194098/28124/en/China-Buy-Now-Pay-Later-Business-Report-2025-2030-Growing-Dominance-of-Super-Apps-Multiple-Sector-Expansion-Low-Entry-for-Foreign-Competitors.html,MELI,newsapi_everything
2025-11-24T13:45:11Z,Biztoc.com,Do You Believe in the Growth Prospects of MercadoLibre (MELI)?,"Loomis Sayles, an investment management company, released its “Global Growth Fund” investor letter for the third quarter of 2025. A copy of the letter can be downloaded here. In the third quarter, the fund returned 7.59% compared to 7.62% for the MSCI ACWI In…",https://biztoc.com/x/e295181065548d6a,MELI,newsapi_everything
2025-11-24T13:23:33Z,Yahoo Entertainment,Do You Believe in the Growth Prospects of MercadoLibre (MELI)?,,https://consent.yahoo.com/v2/collectConsent?sessionId=1_cc-session_0176cf24-4d53-4058-9068-729fcda0b640,MELI,newsapi_everything
2025-11-24T12:54:49Z,Thefly.com,MercadoLibre price target lowered by $100 at UBS,"See the rest of the story here.

thefly.com provides the latest financial news as it breaks. Known as a leader in market intelligence, The Fly's real-time, streaming news feed keeps individual investors, professional money managers, active traders, and corpor…",https://thefly.com/permalinks/entry.php/id4245019/MELI-MercadoLibre-price-target-lowered-by--at-UBS,MELI,newsapi_everything
2025-11-24T11:31:19Z,Biztoc.com,3 Genius Stocks Billionaire Stanley Druckenmiller Just Bought,"Key Points
-
Amazon's stock performance has lagged its peers in 2025.
-
Meta Platforms has fallen since Druckenmiller bought it in Q3.
-
MercadoLibre is a great way to gain international exposure.
Keeping tabs on what billionaire hedge fund managers are doing…",https://biztoc.com/x/3b46c5db9c9fee76,MELI,newsapi_everything
2025-11-21T21:15:41Z,Yale.edu,"Alumni Spotlight: Linda Rottenberg J.D. ’93, co-founder of Endeavor","Rottenberg co-founded Endeavor, a nonprofit that spotlights and scales “high-impact” founders in international markets often overlooked by Silicon Valley. In a Q&amp;A, she discusses her journey from Yale Law School to leading a global entrepreneurship networ…",https://ventures.yale.edu/news/alumni-spotlight-linda-rottenberg-law-93-co-founder-endeavor,MELI,newsapi_everything
2025-11-21T17:25:36Z,Biztoc.com,4 Underrated Stocks to Buy and Hold for the Next Decade,"Quick Read
-
MercadoLibre (MELI) dominates in 18 Latin American countries with over 200 million active users, while ASML (ASML) holds a monopoly on critical AI chip technology..
-
Grab‘s (GRAB) on-demand GMV grew 24% in Q3 with penetration rates below 20% in …",https://biztoc.com/x/302b87958224f94b,MELI,newsapi_everything
2025-11-21T16:51:52Z,Biztoc.com,"The Best Stocks to Buy With $10,000 Before 2026 (Hint: Not Nvidia or Palantir)","Key Points
-
Meta Platforms is not only the second-largest ad tech company but also a leader in the burgeoning smart glasses market.
-
MercadoLibre runs the largest online marketplace in Latin America, and the company is making smart investments to maintain i…",https://biztoc.com/x/0197204cbcd702e4,MELI,newsapi_everything
2025-11-21T00:00:00Z,National Geographic,"Hawaii’s former leprosy colony at Kalaupapa reopens, offering a rare glimpse into history",Kalaupapa National Historic Park on Molokaʻi’s remote north shore now offers visitors a deeply personal tour of what was once an isolated quarantine zone.,https://www.nationalgeographic.com/travel/article/kalaupapa-national-historical-park-hawaii,MELI,newsapi_everything
2025-11-18T10:09:35Z,Biztoc.com,Analysts Lower Price Targets on MercadoLibre (MELI) but Stay Positive,"MercadoLibre, Inc. (NASDAQ:MELI) is one of the 15 Best Aggressive Growth Stocks to Buy Right Now. On October 30, Cantor Fitzgerald lowered its price target on MercadoLibre, Inc. (NASDAQ:MELI) from $2,900 to $2,750 and kept an Overweight rating.
This decision …",https://biztoc.com/x/a47844479190495e,MELI,newsapi_everything
2025-11-18T09:45:48Z,Yahoo Entertainment,Analysts Lower Price Targets on MercadoLibre (MELI) but Stay Positive,"MercadoLibre, Inc. (NASDAQ:MELI) is one of the 15 Best Aggressive Growth Stocks to Buy Right Now. On October 30, Cantor Fitzgerald lowered its price target...",https://finance.yahoo.com/news/analysts-lower-price-targets-mercadolibre-094548578.html,MELI,newsapi_everything
2025-11-18T09:24:34Z,Biztoc.com,"The Best Stocks to Invest $50,000 In Right Now","Key Points
-
Walmart is stable and growing, and it's also a Dividend King.
-
MercadoLibre has robust opportunities as its regions continue to shift online.
-
Taiwan Semiconductor has a varied client base.
Any amount is enough to get started investing, since t…",https://biztoc.com/x/b4764567de2d2418,MELI,newsapi_everything
2025-11-17T22:32:55Z,Thefly.com,MercadoLibre files automatic mixed securities shelf,"See the rest of the story here.

thefly.com provides the latest financial news as it breaks. Known as a leader in market intelligence, The Fly's real-time, streaming news feed keeps individual investors, professional money managers, active traders, and corpor…",https://thefly.com/permalinks/entry.php/id4241600/MELI-MercadoLibre-files-automatic-mixed-securities-shelf,MELI,newsapi_everything
2025-11-17T12:12:21Z,Thefly.com,"Citi lowers MercadoLibre target, opens 'negative short-term view'","See the rest of the story here.

thefly.com provides the latest financial news as it breaks. Known as a leader in market intelligence, The Fly's real-time, streaming news feed keeps individual investors, professional money managers, active traders, and corpor…",https://thefly.com/permalinks/entry.php/id4240894/MELI-Citi-lowers-MercadoLibre-target-opens-negative-shortterm-view,MELI,newsapi_everything
2025-11-17T00:00:00Z,Royal Society of Chemistry,Charge state-dependent ion condensation near conjugated polymer backbones,"Mater. Horiz., 2025, Accepted ManuscriptDOI: 10.1039/D5MH01939G, Communication Open Access &nbsp This article is licensed under a Creative Commons Attribution-NonCommercial 3.0 Unported Licence.Dilara Meli, Quentin Thomas, Nicolas Rolland, Guillaume Freychet,…",https://pubs.rsc.org/en/content/articlelanding/2025/mh/d5mh01939g,MELI,newsapi_everything
2025-11-13T17:06:52Z,Biztoc.com,My 2 Favorite Stocks to Buy Right Now,"Key Points
-
MercadoLibre serves a region that's underpenetrated in e-commerce, but where customers are joining its platform at a rapid rate.
-
Dutch Bros' model is resonating with Americans everywhere, and customers are increasing their transaction frequency…",https://biztoc.com/x/ac8cb6c58fa1f6d4,MELI,newsapi_everything
2025-11-10T04:00:51Z,Yahoo Entertainment,3 Big Reasons to Love MercadoLibre (MELI),"Over the past six months, MercadoLibre’s stock price fell to $2,119. Shareholders have lost 15.4% of their capital, which is disappointing considering the S&...",https://finance.yahoo.com/news/3-big-reasons-love-mercadolibre-040051520.html,MELI,newsapi_everything
